{
  "passport_version": "0.1",
  "synthetic": true,
  "tier": "tier2",
  "site": {
    "site_id": "MWP-PE-0005",
    "name": "Quebrada Sol Copper",
    "operator": "Minera Quebrada Sol S.A.C. (fictional)",
    "country": "PE",
    "latitude": -17.12,
    "longitude": -70.58,
    "primary_commodity": "Cu",
    "mine_type": "open_pit",
    "processing_route": [
      "flotation"
    ],
    "lifecycle_stage": "operating",
    "basin": {
      "name": "Pacific slope river basin (illustrative)",
      "bws_score": 4.2,
      "bws_category": "extremely_high",
      "bws_source": "Illustrative placeholder - production system looks up WRI Aqueduct 4.0 from coordinates"
    }
  },
  "period": {
    "year": 2025,
    "start_date": "2025-01-01",
    "end_date": "2025-12-31"
  },
  "production": {
    "products": [
      {
        "commodity": "Cu",
        "product_form": "Cu concentrate",
        "metal_content_t": 116100,
        "basis": "contained_metal",
        "allocation_share": 0.92,
        "product_t": 420000
      },
      {
        "commodity": "other",
        "product_form": "Mo concentrate",
        "metal_content_t": 2900,
        "basis": "contained_metal",
        "allocation_share": 0.08,
        "product_t": 6000
      }
    ],
    "ore_processed_t": 30000000
  },
  "water": {
    "withdrawals": [
      {
        "source": "surface_water",
        "volume_ml": 11550.0,
        "dq": "measured",
        "subtype": "river_lake_abstraction",
        "quality": "cat1",
        "freshwater_gri": true
      },
      {
        "source": "groundwater",
        "volume_ml": 6300.0,
        "dq": "measured",
        "subtype": "bore_field",
        "quality": "cat1",
        "freshwater_gri": true
      },
      {
        "source": "surface_water",
        "volume_ml": 1050.0,
        "dq": "estimated",
        "subtype": "precipitation_runoff",
        "quality": "cat1",
        "freshwater_gri": true
      },
      {
        "source": "groundwater",
        "volume_ml": 2100.0,
        "dq": "estimated",
        "subtype": "ore_entrainment",
        "quality": "cat2",
        "freshwater_gri": false
      }
    ],
    "discharges": [
      {
        "destination": "surface_water",
        "volume_ml": 3500,
        "dq": "measured",
        "treated": true,
        "quality": "cat2"
      }
    ],
    "consumption": {
      "total_ml": 17910.9,
      "total_dq": "calculated",
      "evaporation_ml": 6268.8,
      "evaporation_dq": "calculated",
      "entrainment_ml": 10388.3,
      "entrainment_dq": "calculated",
      "other_ml": 1253.8,
      "other_dq": "estimated"
    },
    "reuse": {
      "reused_recycled_ml": 39312.0,
      "dq": "calculated",
      "task_water_ml": 54600.0,
      "tsf_return_ml": 19656.0
    },
    "storage": {
      "opening_ml": 1818.0,
      "closing_ml": 1668.0,
      "dq": "calculated"
    },
    "monthly": [
      {
        "month": 1,
        "withdrawal_ml": 2275.0,
        "consumption_ml": 1940.3,
        "discharge_ml": 204.2
      },
      {
        "month": 2,
        "withdrawal_ml": 2204.7,
        "consumption_ml": 1880.4,
        "discharge_ml": 215.9
      },
      {
        "month": 3,
        "withdrawal_ml": 2012.5,
        "consumption_ml": 1716.5,
        "discharge_ml": 247.9
      },
      {
        "month": 4,
        "withdrawal_ml": 1750.0,
        "consumption_ml": 1492.6,
        "discharge_ml": 291.7
      },
      {
        "month": 5,
        "withdrawal_ml": 1487.5,
        "consumption_ml": 1268.7,
        "discharge_ml": 335.4
      },
      {
        "month": 6,
        "withdrawal_ml": 1295.3,
        "consumption_ml": 1104.8,
        "discharge_ml": 367.4
      },
      {
        "month": 7,
        "withdrawal_ml": 1225.0,
        "consumption_ml": 1044.8,
        "discharge_ml": 379.2
      },
      {
        "month": 8,
        "withdrawal_ml": 1295.3,
        "consumption_ml": 1104.8,
        "discharge_ml": 367.4
      },
      {
        "month": 9,
        "withdrawal_ml": 1487.5,
        "consumption_ml": 1268.7,
        "discharge_ml": 335.4
      },
      {
        "month": 10,
        "withdrawal_ml": 1750.0,
        "consumption_ml": 1492.6,
        "discharge_ml": 291.7
      },
      {
        "month": 11,
        "withdrawal_ml": 2012.5,
        "consumption_ml": 1716.5,
        "discharge_ml": 247.9
      },
      {
        "month": 12,
        "withdrawal_ml": 2204.7,
        "consumption_ml": 1880.4,
        "discharge_ml": 215.9
      }
    ]
  },
  "assurance": {
    "level": "limited",
    "methodology": "GRI_303_2018",
    "provider": "Example Assurance Partner (fictional)"
  },
  "sources": [
    {
      "title": "Synthetic demo record (generate_synthetic.py)",
      "extraction": "reported_directly"
    }
  ],
  "context": {
    "competing_users": [
      "agriculture",
      "municipal_drinking",
      "indigenous_communities"
    ],
    "seasonality": "strong",
    "water_grievances": 9,
    "water_incidents": 2
  }
}